index,line_id_standard,audio_file_standard,text,text_length_standard,audio_duration_standard,line_id_dialect,audio_file_dialect,text_length_dialect,audio_duration_dialect,standard_file,dialect_file,dialect_order,audio_file
32,EN0037,sof_00295_01965383030,The value of a pleasure or pain considered by itself can be measured according to its intensity duration certainty and proximity,21,10.325333333333333,EN0037,nof_02484_01753809615,21,9.813333333333333,british_dialects_southern_female,british_dialects_northern_female,dialect-standard,32_british_dialects_northern_southern_female
33,EN0012,sof_00295_00487793813,Others have tried to explain the phenomenon physically,8,4.778666666666667,EN0012,nof_05223_01356253657,8,4.864,british_dialects_southern_female,british_dialects_northern_female,dialect-standard,33_british_dialects_northern_southern_female
34,EN0010,sof_05223_00864403602,The Greeks used to imagine that it was a sign from the gods to foretell war or heavy rain,19,6.741333333333333,EN0010,nof_02484_01929055633,19,4.949333333333334,british_dialects_southern_female,british_dialects_northern_female,dialect-standard,34_british_dialects_northern_southern_female
35,EN0021,sof_01208_00764898167,This is a very common type of bow one showing mainly red and yellow with little or no green or blue,21,6.826666666666667,EN0021,nof_03397_00596556615,21,8.192,british_dialects_southern_female,british_dialects_northern_female,dialect-standard,35_british_dialects_northern_southern_female
36,EN0003,sof_03349_00900506813,These take the shape of a long round arch with its path high above and its two ends apparently beyond the horizon,22,8.448,EN0003,nof_03397_01002368142,22,8.362666666666666,british_dialects_southern_female,british_dialects_northern_female,dialect-standard,36_british_dialects_northern_southern_female
37,EN0028,sof_01208_01117587626,Oil was discovered on the site on March the third nineteen thirty eight,13,5.034666666666666,EN0028,nof_02484_00118844408,13,5.546666666666667,british_dialects_southern_female,british_dialects_northern_female,dialect-standard,37_british_dialects_northern_southern_female
38,EN0048,sof_07973_02135624756,Tourists are enjoying fresh air in our pleasure gardens all year around,12,5.205333333333333,EN0048,nof_06136_00228342720,12,6.912,british_dialects_southern_female,british_dialects_northern_female,dialect-standard,38_british_dialects_northern_southern_female
39,EN0038,sof_02436_00598880543,Statistical conclusion validity involves ensuring the use of adequate sampling procedures appropriate statistical tests and reliable measurement procedures,18,10.922666666666666,EN0038,nof_04310_00238519531,18,10.496,british_dialects_southern_female,british_dialects_northern_female,dialect-standard,39_british_dialects_northern_southern_female
40,EN0030,sof_07060_01246398902,A full-scale use of nuclear weapons by two or more opposing sides would cause the complete annihilation of both the attacker and the defender,24,9.301333333333334,EN0030,nof_06136_01430518635,24,10.581333333333333,british_dialects_southern_female,british_dialects_northern_female,dialect-standard,40_british_dialects_northern_southern_female
41,EN0008,sof_01208_02139837814,Some have accepted it as a miracle without physical explanation,10,4.778666666666667,EN0008,nof_06136_01014441158,10,6.314666666666667,british_dialects_southern_female,british_dialects_northern_female,dialect-standard,41_british_dialects_northern_southern_female
42,EN0046,sof_07508_01650790453,Travelcard and Oyster card fares are managed by Transport for London,11,5.461333333333333,EN0046,nof_06136_00465246257,11,5.290666666666667,british_dialects_southern_female,british_dialects_northern_female,dialect-standard,42_british_dialects_northern_southern_female
43,EN0029,sof_04310_01487492181,Mutually assured destruction is a doctrine of military strategy and national security policy,13,7.765333333333333,EN0029,nof_06136_01527964558,13,7.850666666666666,british_dialects_southern_female,british_dialects_northern_female,dialect-standard,43_british_dialects_northern_southern_female
44,EN0033,sof_03349_01696121620,Western societies have gradually adopted more casual dress codes in the workplace school and leisure,15,7.082666666666666,EN0033,nof_06136_00440443072,15,8.448,british_dialects_southern_female,british_dialects_northern_female,dialect-standard,44_british_dialects_northern_southern_female
45,EN0036,sof_08421_00028080961,Direct actions employ specialized military capabilities to seize destroy capture exploit recover or damage designated targets,16,10.154666666666667,EN0036,nof_04310_00776598778,16,10.069333333333333,british_dialects_southern_female,british_dialects_northern_female,dialect-standard,45_british_dialects_northern_southern_female
46,EN0009,sof_02121_00784836883,To the Hebrews it was a token that there would be no more universal floods,15,4.266666666666667,EN0009,nof_03397_02111829577,15,6.4,british_dialects_southern_female,british_dialects_northern_female,dialect-standard,46_british_dialects_northern_southern_female
47,EN1321,sof_02484_00110539386,Pillow lavas are lavas that contain characteristic pillow-shaped structures that are attributed to the extrusion of the lava under water,20,9.130666666666666,EN1321,nof_05223_01942446127,20,9.898666666666667,british_dialects_southern_female,british_dialects_northern_female,dialect-standard,47_british_dialects_northern_southern_female
48,EN0877,sof_03397_01838683454,From the level of a small boat the island with its palms colonnades and pylons seems to rise out of the river like a mirage,25,9.301333333333334,EN0877,nof_03397_00242493680,25,10.154666666666667,british_dialects_southern_female,british_dialects_northern_female,dialect-standard,48_british_dialects_northern_southern_female
